{
  "artifact_type": "gtm_audit_report",
  "schema_version": "1.0.0",
  "run_id": "task-4.4-smoke-valid",
  "client_id": null,
  "source_container_summary": {
    "input_file_name": "source_container.json",
    "account_id": "1000",
    "container_id": "2000",
    "container_name": "Smoke Test Container",
    "export_format_version": 2,
    "entity_counts": {
      "tags": 1,
      "triggers": 1,
      "variables": 1,
      "folders": 0,
      "templates": 0
    }
  },
  "audit_summary": {
    "summary": "Minimal smoke-test audit report.",
    "finding_count": 1,
    "highest_severity": "low",
    "human_review_required": true
  },
  "findings": [
    {
      "finding_id": "finding-001",
      "severity": "low",
      "category": "naming",
      "title": "Sample naming review",
      "description": "A sample tag name was reviewed for smoke-test traceability.",
      "affected_entities": [
        {
          "entity_type": "tag",
          "entity_id": "1",
          "entity_name": "GA4 - Event - purchase"
        }
      ],
      "evidence": [
        {
          "evidence_type": "observed_fact",
          "observation": "The sample package includes one reviewable proposed change."
        }
      ],
      "recommended_actions": [
        "Review the proposed change before import or production use."
      ],
      "related_change_ids": [
        "change-001"
      ],
      "human_review_required": true
    }
  ],
  "manual_review_items": [
    {
      "item_id": "review-001",
      "reason": "Confirm the smoke-test proposed change before import.",
      "related_finding_ids": [
        "finding-001"
      ]
    }
  ],
  "assumptions": [
    "This is synthetic smoke-test data."
  ]
}
