{
  "artifact_type": "gtm_audit_report",
  "schema_version": "1.0.0",
  "run_id": "sample-run-001",
  "client_id": "sample-client",
  "source_container_summary": {
    "input_file_name": "source_container.json",
    "account_id": "123456",
    "container_id": "GTM-SAMPLE",
    "container_name": "Sample Web Container",
    "export_format_version": 2,
    "entity_counts": {
      "tags": 2,
      "triggers": 2,
      "variables": 1,
      "folders": 0,
      "templates": 0
    }
  },
  "audit_summary": {
    "summary": "Sample audit report for schema validation.",
    "finding_count": 1,
    "highest_severity": "low",
    "human_review_required": true
  },
  "findings": [
    {
      "finding_id": "finding-001",
      "severity": "low",
      "category": "naming",
      "title": "Sample naming inconsistency",
      "description": "A sample tag name does not follow the agency naming convention.",
      "affected_entities": [
        {
          "entity_type": "tag",
          "entity_id": "1",
          "entity_name": "Sample Tag"
        }
      ],
      "evidence": [
        {
          "evidence_type": "observed_fact",
          "observation": "The tag name lacks the expected channel prefix."
        }
      ],
      "recommended_actions": [
        "Rename the tag in the proposed optimized container."
      ],
      "related_change_ids": [
        "change-001"
      ],
      "human_review_required": true
    }
  ],
  "manual_review_items": [
    {
      "item_id": "review-001",
      "reason": "Confirm the proposed name matches client conventions before import.",
      "related_finding_ids": [
        "finding-001"
      ]
    }
  ],
  "assumptions": [
    "Sample data is for schema validation only."
  ]
}
